application_id,arn,card_number,customer_id,transaction_datetime,transaction_amount,description
332885530753559438,845151738,4156542467471210,45608466034,2024-12-10 23:38:38,"3,415.26",Customer risk management finally nature.
562877767716302427,987844293,4305949632437184,53683559583,2024-11-30 23:35:14,"1,246.72",From agreement truth throughout because customer.
863172509547202302,458125783,4783796695214435,63436156397,2024-08-30 09:05:17,"2,373.96",Green deep well way action reason.
865992899883442000,543232357,4542692958521537,48518117055,2025-03-03 23:21:58,"2,821.38",Word reduce even on close sing.
350543697881120215,650790778,4201130327104182,62215731420,2024-05-16 12:11:05,"2,600.82",Economy bed either.
209910750160066811,635955057,4895116155909512,73127493762,2024-06-27 17:41:56,"3,037.56",Toward first three financial.
780709329737098261,870141939,4000025607326807,98121712843,2024-11-17 18:29:40,483.56,Billion identify admit idea fight develop.
831194412609892381,860142253,4904686890990703,92192049358,2024-11-13 07:55:17,"3,123.99",Whatever any policy leader itself bank.
655999241767039162,861685060,4364549749446371,25996994528,2024-06-22 20:18:14,"2,948.64",Coach price check.
291059797611037309,234961535,4377225543031587,59148870500,2024-07-05 05:35:07,"3,329.01",Type stage American even.
710213595445505976,326715102,4334783298892563,28713490466,2025-02-10 16:23:45,"2,869.53",Thing enter begin.
851640209565304034,263755422,4376984078692780,76462067946,2024-08-27 05:42:00,"1,850.13",What study wrong amount claim.
450617879625052550,333009957,4892968196796669,76369426725,2024-11-12 13:31:28,208.42,Computer town rock star option.
420189712155422960,373534797,4873706302674989,62201487739,2024-09-17 21:07:13,"2,674.76",Inside herself finally important.
386695539553929565,891930783,4972805113437253,22464367754,2024-04-25 16:47:14,663.64,The decide enough wrong moment after.
939713443107648819,881420285,4925565995446099,70480554672,2024-08-23 12:57:42,"3,831.7",Recently face street concern.
435940923925448120,585951217,4513763867753910,16738128166,2024-08-20 02:16:13,"1,813.19",Raise big night how nation.
726502046430297558,720939032,4279410288220350,24220214071,2024-06-10 17:04:06,"4,394.87",Ahead memory possible.
127970896071138847,118631757,4215812080739171,21636055316,2024-04-13 04:42:16,"4,499.26",Avoid strong interview cover fine condition.
357397186249394200,253784365,4797794697474457,69552592637,2024-06-16 16:27:15,"3,112.45",I every environment entire majority.
773381925466373833,370633461,4745710397415601,13990950087,2024-07-11 18:04:28,"1,669.53",Increase bill indicate thus.
104121227700128629,955250945,4366958769712737,54543657709,2024-12-26 08:35:23,"4,672.55",Program only forget level.
157775496816969104,738498034,4282603939845329,58369443029,2024-10-13 18:36:25,"4,115.59",Clear fast order spend none.
281415557601082589,753478913,4260058476227165,66938911757,2024-10-20 14:03:19,"4,299.64",Age culture book thousand.
314169045387648162,237118113,4261133596929476,54483083323,2024-12-14 14:18:38,668.97,Sea his amount class.
410388914583425649,350491089,4895566530641968,71274836937,2024-04-21 01:28:29,"3,192.46",Him assume something standard which.
975072437432912168,721184261,4213817638240848,53505203653,2025-03-03 20:45:00,64.73,Adult business mother listen.
831748709474183741,420870623,4942585232114937,93431208326,2024-04-04 02:55:57,"3,277.76",Order resource another special hard.
341467928815606045,612037263,4800175795941586,90853361856,2024-05-06 19:05:11,"4,078.4",Poor back oil story indicate.
242879241755374690,139241800,4500462181242396,69088764485,2024-08-25 07:36:58,"4,547.74",Range threat scene style front let.
346821445658120882,757027726,4710909539889670,50821949695,2024-12-25 16:23:50,992.73,Nation change society win.
433174243964014423,970106176,4147802967319539,99266789524,2024-08-09 14:29:57,"2,844.08",Pressure water smile account kitchen.
934291903872668832,149907022,4877474573837761,55324199906,2024-10-11 08:48:10,"1,531.97",Use end girl.
862750717096295600,644825889,4250081163079642,81346956472,2024-07-05 14:06:51,"2,021.59",Bit born perhaps serve personal develop.
327242874638818360,376363876,4052899399458722,17433717842,2024-08-20 19:09:21,"4,433.71",Safe prove space life again better.
881483924086899595,573430602,4175797744221237,21645360146,2024-12-31 10:12:24,"2,475.64",Anyone majority speak story operation example.
814643870974678953,357544127,4267151311211255,62216662959,2024-12-01 02:02:21,"2,299.39",Person two would.
507962040839550798,226508594,4574942787167759,98407180078,2025-01-14 23:02:26,"3,228.79",Sell drug government serve.
502669595309178627,492676130,4387547149020286,75334690876,2024-09-18 20:01:46,"4,348.33",Hair professor avoid people feeling.
561030742656949969,896399028,4874076190713086,96108671525,2024-06-29 20:25:54,179.93,Step stay hair beautiful group.
138895303603858364,228464474,4335995760642628,99938574840,2024-06-28 03:30:09,"1,061.97",Mr organization measure single.
961102339081804062,471668904,4872225150539328,72091323365,2025-01-13 10:55:46,"4,537.7",Imagine Republican order glass collection much.
289656214552080548,420962260,4268853900168791,69412201136,2024-07-01 07:53:32,31.9,Could kind year arm.
337788712518934746,536093883,4437406037904822,94684945363,2025-02-23 05:07:15,273.73,Commercial page authority.
934919053695572308,262004485,4413605158848720,97123474269,2024-06-13 14:19:51,553.98,End collection whether father still give.
973132195888202758,417700142,4947383840793689,32769680966,2024-10-31 01:18:07,"3,545.68",Experience better likely view party east.
984862881236255438,959800817,4280467979399619,14308342524,2024-10-12 18:05:33,"3,952.71",Property both seem bag lose.
899855013447310450,785879698,4553375818154162,51701670811,2024-09-04 12:34:07,"3,402.88",Positive general ask.
291039177507197129,650659960,4907650241452166,98631336517,2024-07-15 04:54:38,"2,637.61",Smile rule him.
354603235997817309,506512191,4258661645078940,27579554737,2024-11-02 17:21:38,"1,708.63",Add economic party individual.
976373663987229480,669440242,4071608993345350,40516215117,2024-03-12 17:45:49,224.98,Energy wife option.
698365199488528058,114217539,4778586561895061,76074997302,2025-01-19 15:37:38,"4,877.4",Write yard marriage.
736590811385919763,471101041,4619010362562708,79211393451,2024-03-17 21:30:12,"1,066.34",Receive require gas in.
809713135625964171,631524754,4714997403445279,73317004409,2025-02-05 10:48:00,"2,186.67",Garden else main under animal.
880338515558574704,138942023,4402588213503204,69774917880,2024-05-08 18:08:45,"3,932.1",Rule generation strategy them.
848731532649512288,896014214,4265459255557621,55418086726,2024-04-30 12:24:22,"4,528.25",Election possible executive.
927377754211993621,946143842,4689255220655799,97721236270,2024-03-21 14:03:45,"3,513.21",Wish wait by.
912715258956925969,903899628,4867658875740176,31913955031,2024-10-24 09:04:06,"4,615.63",Reduce happen stage star budget.
596728475230836965,592438955,4466642014724858,21463147912,2024-06-10 12:31:54,"3,342.06",Eight air Mrs girl.
164661046157531449,369779924,4929198318262930,88097041961,2024-11-03 19:15:32,"1,179.85",Yet keep single check although ten.
395624622648147457,399236799,4399624087070767,71669171657,2024-09-18 02:53:32,"3,086.16",Book message who price.
795509249416290001,543388684,4736395862220453,28352537626,2024-09-30 03:59:45,"3,610.43",Between soldier anything need government need.
495387603645123820,551835246,4312899569367006,40235545130,2024-12-20 12:11:19,"1,543.24",Participant stop medical hand.
673763146651248419,555052491,4355487545308373,16503745496,2024-12-06 10:37:23,"2,939.35",Just entire build provide.
299555097936815385,558916063,4680813112979955,61035737423,2024-11-25 03:06:05,"4,455.2",Culture tell music measure audience.
807965540689034928,495314656,4502442683141948,31948140971,2024-12-19 22:02:49,"3,068.37",Its field nature pull begin clear science.
606659678878966177,372939436,4308988206415835,23163911644,2024-06-08 06:34:38,"3,091.7",Travel rate food their after.
735856625155691150,488949399,4943715550347590,38709230437,2024-07-16 18:51:03,"2,146.95",Why color themselves simply soldier.
247608725279953909,812376871,4661313787381739,52747083633,2024-12-13 00:50:51,"3,918.4",Full kitchen also.
912818354841264702,739761428,4404321395108073,66000503369,2024-08-04 04:18:15,"1,084.82",Other participant go.
660038384523212839,292127910,4706572762823141,97795284937,2024-05-10 09:27:13,"3,202.28",Often present young writer medical animal.
483455195003360274,322866929,4803498678896447,40337193367,2024-05-17 01:43:13,"1,019.63",Meet benefit focus determine.
966826880140062533,821651666,4149523352801489,67109329219,2024-03-25 22:41:45,"2,878.69",Soldier identify likely.
626845455499748125,615072241,4253201093592434,78409132660,2024-10-30 05:11:32,117.54,Realize company time.
875585475383114481,411380424,4666743959191802,37305693350,2024-11-13 09:09:46,"1,230.75",Chair respond no record condition national.
202698058006306963,627282604,4640041948219441,18319958471,2024-12-06 18:28:36,"3,109.47",Product memory look several.
340405702373319484,774110343,4515734894572787,14089870157,2025-01-30 14:20:14,"3,219.51",Front list college ten population Democrat.
178988081118658145,999026349,4187782997114798,47747549144,2024-08-06 19:13:42,"2,480.8",Mouth become garden raise get national.
793300699121669541,935375358,4378150989649529,74305176349,2025-02-06 12:11:12,"2,197.76",Purpose camera professor artist allow western.
548410277378737683,855038624,4553591858868020,82974297966,2024-04-18 09:06:09,"3,772.9",What get dream travel one reach.
456427146866416876,738783568,4952713738444031,16631600002,2024-06-01 19:38:33,"3,787.79",Mind government save sound.
165879886587854844,879671865,4136551473623040,76679971514,2024-09-21 08:47:12,"4,077.51",Able since change find.
438019221804898383,963828608,4821400016171572,30661319166,2024-03-24 23:42:44,"2,652.36",Customer score hundred develop back government.
513425407952579522,809843872,4332380924816249,28713683370,2025-02-05 13:21:19,63.98,Fear call hope response well.
197639820442144457,700337924,4112005838554117,45091474634,2024-12-07 19:45:53,"1,759.55",Yet former walk ahead security.
139886790040965133,564077346,4418524035942736,54857755582,2024-11-28 22:40:48,"2,736.8",Entire gun pick customer current miss.
915940153034620388,247104954,4706132872693684,94238636649,2025-01-30 14:12:52,530.14,Life wide price.
415642152109658313,302134867,4832375901055907,44680074836,2024-05-18 13:35:42,867.36,Deep store cost build put.
843431519847628235,422640239,4199439007303392,55808107153,2025-01-31 02:23:57,"3,658.73",Fund its me.
756757181196591373,171886370,4413971326638280,32423626444,2024-06-15 19:25:46,"1,223.98",Provide heavy trial yeah.
227810166850998159,911036610,4294108867704197,70437943846,2024-05-06 00:38:22,"1,581.3",On design owner over and.
323220376165976039,508952347,4623837998712842,83441654138,2024-05-22 04:48:43,357.21,Matter night level soldier cut media.
249756785556001309,108502339,4923085085078993,66836000674,2024-07-20 04:18:53,"3,858.97",Ahead time line task assume.
301443511142076830,280308050,4567229988430510,44347237570,2024-07-15 03:59:40,592.49,Share quality gun economy.
901983194242058199,220228322,4721590234747004,93728243793,2024-11-26 03:13:35,"2,100.83",Page appear decade interesting.
366442925485098858,872892500,4653638242667698,76293615137,2025-02-24 16:05:31,"1,960.22",Much heart consumer out lot.
946455965163037941,359500827,4561125222637116,94616618740,2024-04-27 01:29:57,"1,924.86",Eat want structure move her drop.
399828976657907524,679309062,4811582511620286,43963418473,2024-06-17 02:47:48,"1,407.01",Call stand air candidate.
217904760606449830,356870769,4912158806067174,14804504447,2024-12-03 23:05:49,"3,859.37",Statement writer type difference.
468346812128063554,778893750,4058126425096712,87623920865,2024-11-11 02:45:12,"3,281.16",Somebody almost serve.
124041814747552503,581372404,4566946792743470,69246053884,2024-11-02 22:32:27,"2,464.29",Point cut take medical reduce.
759150168319171291,836513698,4066127884636444,51892496152,2024-04-11 20:03:25,313.87,There able best enjoy.
540137800398710018,522650829,4076273324449465,95674480193,2024-07-02 17:46:00,134.71,Short save middle live thus cut.
513532909812837489,214393242,4764924112691489,74909879681,2025-02-27 03:00:20,"1,944.21",Above there environmental family.
389263753167903696,288345303,4705603273584657,22456965416,2024-08-08 21:50:18,"4,458.48",Word receive create democratic ask owner.
932752722320992257,899724504,4916060236854948,97961813696,2024-10-22 23:35:52,"3,171.93",Yet letter town stuff new teach.
841279741021386724,584139931,4055860897572064,94322265042,2024-04-19 12:49:48,"4,850.45",Early question less who great door pull.
221593411729274840,790200653,4308093506022223,58812589226,2025-01-08 12:37:29,"1,206.26",Phone claim cup reveal event.
242996007783743020,723941769,4462975789501331,85871741717,2024-10-07 02:08:53,"1,310.47",Every truth project under page.
702743484479707186,887305971,4923951334871340,30775043148,2025-01-22 02:44:03,"4,350.46",Difficult listen popular war traditional party.
410261926896265232,202695390,4872277761174169,71540801374,2024-09-02 18:48:08,"2,038.34",Senior good around final company course.
617855176421547126,625732616,4416980243977454,16805265628,2024-06-08 07:35:29,709.38,Hair life health Republican.
612565556421264724,916957504,4011420957679623,48253037372,2024-03-27 04:37:31,"2,723.2",Happy foot wait join.
595043613809777492,199153917,4971822941333589,24407310918,2024-09-07 16:14:26,"1,719.95",Check car matter any.
534391604258699713,621238551,4786980424125644,46055951094,2024-10-27 14:48:28,"1,366.15",Treat receive know.
584055558545413214,120687520,4598583951550719,50518907130,2024-11-07 07:07:35,"4,356.54",Field floor fire.
551580261379891291,885464087,4005682668579446,22288668257,2024-04-06 09:04:55,"2,867.17",Series nature watch example.
910623216090074194,900389228,4139763841704868,98675043093,2024-08-24 22:39:33,"1,634.84",Billion yourself ever care prove finish.
385190300477357837,652447082,4368148164726247,68397464736,2024-04-16 13:53:27,763.93,Baby soon case south star during.
708373187569660669,999932540,4211377553317461,45711708152,2024-03-24 17:50:16,"1,479.33",Away important produce agency rule purpose.
426244481473043383,635355419,4556418806423459,70781886909,2024-08-27 16:07:19,"1,997.5",Despite meet indeed system drop perform.
589063241187067079,704389722,4484687946451755,99546017719,2024-11-01 14:32:32,"4,902.81",Condition reason despite clear such yourself.
552032385217560040,870177799,4291461408410508,15226922132,2024-04-09 13:08:57,"4,597.51",Dinner kind somebody operation.
268542642719641326,264762727,4736704876245663,47083424457,2025-01-04 16:15:34,"2,587.79",Society serious including if off general girl.
779729343732915316,813592717,4414880012185937,18719582256,2024-05-29 11:42:37,400.11,Information benefit billion window yourself.
937483912947953875,551669944,4187320632132709,79535785376,2024-03-12 05:26:40,180.77,Mother none similar ever.
830997534235712349,503464519,4346440592902277,96221783316,2025-02-11 01:38:38,"1,971.42",Health out wear discover open.
928795713895199442,812361256,4495693221676964,76373730028,2024-09-28 11:47:50,"3,696.98",Be goal event kitchen by.
675623857869354950,694038494,4630239492892652,70128535195,2024-04-20 06:56:21,"2,751.93",Wife of together threat heavy month.
540045895732457718,261414296,4065819858296483,83451479795,2024-12-12 17:53:13,"2,708.14",Teach baby ask clearly this.
990763504377703794,425714472,4372177357244050,15753504877,2024-08-20 20:21:02,"3,005.53",Compare land hotel southern its something.
741447542730786381,876217249,4540232018443794,34668301612,2025-02-25 02:37:32,"3,645.31",Sure establish provide serious production plan.
944969035360685907,511662839,4201111278125194,13583923255,2024-10-01 13:57:13,"4,785.08",Community some poor high relate stock.
717385208271184615,174462667,4122544225075409,22584944974,2024-08-25 09:10:22,214.62,Support pay seek teach.
531662628167861601,871360505,4304182719424039,16489285423,2025-01-07 09:11:29,"4,021.84",Tax meet stand many likely ability.
104374828258624498,599983942,4471680195247334,26676683719,2024-05-12 14:00:44,"4,648.74",Charge when team accept month.
605507701368795146,939603812,4017743510145590,11790007975,2024-08-04 20:30:48,"1,499.19",Professor check this anything.
107557710870924076,410540001,4960564558317983,85711593022,2024-08-20 15:35:59,"4,196.57",Matter authority seek top factor number.
966182122445660316,241027291,4622571859163933,87309773064,2024-05-29 09:38:20,"4,230.67",Degree accept add.
843771695847573967,948224146,4652631792839826,91928696506,2025-01-28 12:31:26,"1,837.39",Eight chance main usually.
981790001033635863,682993902,4945058318443478,49627060941,2025-02-10 22:28:52,46.88,Recently tree according.
998809762195122495,341323838,4082365621335322,14894569130,2024-12-04 19:23:24,"3,926.8",Moment computer general.
257888630970970884,553967709,4716671644424801,39930596711,2024-09-09 19:29:34,"2,833.83",Catch well war.
199585567777250040,956766707,4101244298286471,90202131762,2025-01-24 09:21:21,"4,549.85",Term her picture.
661624861365430898,527942844,4891397482360645,23659139576,2024-04-15 02:54:18,"1,380.84",Better instead while.
524247123588502033,581495903,4954153891551033,59866733833,2025-01-01 16:37:59,502.31,Ever face guess certain room.
243713870699262422,951102141,4531437510858669,17104898367,2024-06-13 13:10:43,"2,876.91",Leader how expert concern.
813151675644707723,702115607,4099896628277449,71309393934,2024-07-01 04:09:45,"4,834.69",Song best civil remain manager.
763440925767094297,383460746,4389384843495582,63991269701,2024-08-26 22:46:53,"3,507.92",Deal action year special.
931740967279289300,979514103,4326901296194085,60879031215,2024-11-07 20:58:55,"3,687.31",Almost explain resource action east.
476916397703126942,893003239,4543809765378971,56827926666,2024-12-14 01:23:00,"3,982.7",Today tend those manager huge car.
382783971790793858,782885997,4199281771943627,39271883943,2024-08-13 14:55:50,"2,992.86",Here customer management strategy style back.
834090588118367672,904925963,4676897023695236,33906524134,2024-10-25 16:50:15,"1,519.57",Police arm gun everybody process consumer.
372486712303859204,376165180,4713336555608304,55737232967,2024-11-19 18:10:37,750.73,Pretty small trip since protect.
464140515642097077,391568266,4467658351974657,27734751347,2024-04-12 06:14:15,"4,499.37",Whatever son let green reason.
699996838135907709,795894706,4545666680155050,79313271428,2024-04-22 23:37:20,587.19,Spend team situation.
621184203347750916,342292340,4449062841905087,17839758579,2024-09-14 13:45:38,"4,823.5",Expect within consumer military.
309572365703929856,975029463,4845088570951588,80610893530,2024-05-21 13:29:28,"4,565.02",Human yeah group herself.
839221111915918192,749842728,4249209510538184,55619993703,2024-05-25 01:36:01,574.58,Political although claim name.
818364150528242983,479705979,4902276691846965,83620431925,2024-03-25 14:07:58,"2,606.76",Word day career million.
465672601212519466,983273588,4467259938662772,81014248484,2024-06-11 07:58:32,"4,505.98",Table lead poor.
812683016799324761,682275509,4669599918924189,77066564520,2024-07-02 16:03:03,676.17,Town argue own or air list system.
400098422250361181,598485217,4830719105571833,46359008096,2024-09-02 00:00:28,"1,591.83",Owner offer tell chance sound perform.
830338274908347392,205488267,4590731171740465,10874908361,2024-12-21 04:01:12,"1,627.76",Wrong design either foreign attention.
745965823127722142,704575563,4572138446310706,12808610060,2024-07-25 11:10:20,"3,294.71",Year owner increase world.
765018347739561523,535516797,4960276061415887,84256495264,2024-11-19 13:57:33,"4,611.51",Appear tough involve while five federal.
123958079732861196,554997984,4581520073776292,61596215846,2024-05-01 15:41:57,"2,469.39",Think defense low let.
565814005852055433,278659017,4996728817124658,37067485550,2024-07-10 20:47:58,836.42,What behind mention should.
669418937904340059,424180914,4500134951796774,50608397229,2025-02-11 08:34:56,"2,273.92",Clear sister newspaper old.
712340131862786681,982966130,4716254149114969,70175772385,2025-02-26 10:28:32,"2,823.25",Interview woman difficult develop.
777324265271885218,505606055,4332870135323233,58593087470,2024-03-23 23:39:37,"1,229.53",East ground best name.
480855502791389411,309426412,4878553085141975,17463434613,2024-10-15 13:57:30,"1,546.71",She process physical seem bit.
146361655351125601,884577727,4812293716204210,35701910596,2024-05-02 10:29:49,"4,851.84",Good together quite.
407117544371742218,978592116,4501526071199095,56264408847,2024-10-04 17:51:49,"3,910.31",Sing public Congress.
512919595614074212,361659061,4551299435575249,13479259621,2025-02-10 07:50:19,"1,120.48",South he almost Mr crime.
626962715437965483,815596856,4905846450736669,69952753405,2024-12-21 07:33:44,"2,749.74",Least laugh while represent human really.
311051047635926406,465303424,4745564291827324,42963340331,2024-04-08 02:38:15,"4,447.55",Force together power fast letter black.
280570926384089223,953834754,4834303515989616,43866381799,2024-04-14 15:30:49,"4,957.75",Door majority nice be life.
751635330436755913,500069559,4722476587709917,67078225683,2024-11-24 02:01:15,"1,775.15",Project hour customer.
962147980237843712,246241803,4491170421578187,43469159020,2024-07-30 07:37:49,"3,130.58",Government east know.
924908837530975640,670206680,4255412223131526,28431280607,2024-05-11 07:15:14,"1,493.04",Oil agree let center.
344482802511418885,419366586,4977216653317613,93912357513,2024-11-23 21:02:08,"3,531.84",None heart wall determine technology situation.
931706040926884879,707605334,4891865882301096,12447338535,2024-11-17 13:34:06,"1,684.17",Interesting work military.
831921271183122329,768546495,4750574700287921,34445175262,2024-07-14 20:30:57,"2,316.47",Poor interesting price add rich happen.
592979695121567319,313152835,4056305527117343,30097556492,2024-10-26 03:38:08,"3,457.01",Make policy education.
369972919171255152,425315554,4832990077445169,51391590077,2024-07-02 14:15:05,"4,939.06",Whole serious professional cut car.
895308609867487268,913235813,4095121878154295,99976049688,2025-02-14 04:38:17,"2,962.41",Together include modern sign something mean.
476966353915521977,694581998,4750445421456196,65640599010,2024-10-23 06:58:29,"3,960.24",Write woman man ability soon party.
404132838184744135,200160772,4641753036747427,24180587538,2024-11-10 21:21:52,"3,494.68",Treatment ever network admit.
559995330054411806,929088196,4290583614322853,83460249432,2025-03-02 01:16:45,"4,371.45",Military near improve wear hear send.
201844057862389858,857087283,4142241529081631,91111049201,2025-01-15 01:50:59,272.11,Improve production culture event.
242035859175637720,144102207,4311565196376204,35262393345,2024-03-11 02:00:07,"2,161.4",Safe nor sister.
374190837240014584,341176615,4638997657775903,76458689850,2024-09-13 02:41:20,"2,568.93",Laugh develop agency so.
848624550233021477,382023073,4166508859212726,41765230854,2024-06-17 07:41:56,"3,148.76",Executive admit worry with strong.
284021134462255463,134060971,4346523153606195,55851027947,2024-04-18 03:15:32,"3,451.98",Stand three as experience.
962535698988016579,639062354,4832014986992573,28224819947,2024-07-20 08:31:40,"1,692.11",Glass including rate lay impact game.
763339064015455024,493998030,4603157297048374,15437933315,2024-03-13 06:29:37,"1,594.05",Now despite effort his.
147183504323507093,895075045,4964970842621807,99754370315,2024-04-29 03:51:00,"3,668.11",Range body agreement up.
297073658590680936,256939046,4258123396472830,64888590197,2024-08-12 23:32:35,467.27,Behind they remain themselves.
828169703747184589,511776500,4061520177557340,51412294256,2025-02-02 04:43:33,"2,264.79",Use life message morning top.
478732545839275587,620956119,4922858940525189,88984520671,2024-12-16 10:42:41,"2,891.9",Quality shake participant understand.
310886971812276085,652442365,4033763359891781,52363645089,2024-12-08 09:37:52,"1,018.82",Office eye give design.
354700188307602042,954649311,4445379838784794,53571480227,2024-11-20 16:59:46,"1,857.09",Model somebody action.
510313299470781945,515815164,4492965481498211,22210958670,2024-10-23 17:34:29,"2,879.73",Fight operation suddenly owner skin big.
816360474061907859,653771972,4244417922118652,14380093764,2024-10-12 09:14:46,"4,012.46",Summer modern finally cause method treatment.
726339699872739393,313860596,4528296377088249,34540192522,2024-08-22 23:57:23,"1,866.9",Much travel eight.
720857804391891779,896718992,4114392921447013,22084611954,2025-01-11 19:59:27,"1,023.84",Serve vote half enter.
800163261981777027,909323722,4427243436447844,42699837898,2024-09-25 13:49:53,135.88,World many front whether determine buy.
901063571379410532,174351335,4649677687066245,62736124712,2024-03-15 15:21:12,"2,773.03",Six factor especially.
622166229014046735,462838033,4203840042833786,50424391387,2024-07-26 20:01:31,"4,231.07",Enjoy apply technology none author form.
192118205397933350,340282575,4471521799692741,38021714233,2024-04-04 08:48:59,"2,866.12",Truth hair million difficult early feeling.
367142256384870928,852807462,4596717592984489,23186078285,2024-11-16 01:50:06,"2,473.31",Past firm at.
909774794391526039,105154659,4518159117691445,44808953344,2024-12-27 03:30:08,"1,859.34",Space game official meeting drive.
731274416825116069,262455833,4133126432150733,40078941682,2024-08-16 17:01:48,"2,623.29",Know result use structure.
349776432891615381,943191283,4327688738092253,16368402051,2024-12-18 21:35:50,372.53,True know rock major.
661964868931973796,965069821,4503412475512613,86075259887,2024-09-18 03:19:05,"2,885.35",General whom police.
