application_id,arn,card_number,customer_id,transaction_datetime,transaction_amount,description
606637059168710353,748774899,4186540615717330,85970942662,2025-03-02 10:39:08,"2,819.39",High at rise most forward explain.
540535344213253329,521610190,4122388012501338,70483526088,2024-05-21 15:24:11,"4,325.87",Toward three six role do focus.
888397202308376094,324830886,4701361261282305,47255427073,2025-03-04 15:53:51,"3,020.33",Here whatever knowledge.
750209753880216014,321940666,4053910267815494,35482204259,2024-08-23 02:19:48,340.22,Line daughter free.
889979180361109259,176862404,4095728101189714,43926226268,2025-03-05 07:01:10,"4,586.6",Brother knowledge spring.
520775843498988922,271795441,4272770875978224,32296877126,2024-06-29 13:40:09,"2,149.69",Above word their.
585556579915498804,749773499,4105911387961588,84899175726,2024-10-08 21:32:41,"4,355.75",Perform imagine prove it grow pressure.
289622801736292365,703619858,4168084464585268,96403510189,2024-06-09 12:15:03,864.04,Help behind very without.
435260825522155879,705031087,4897165401815203,28754350067,2024-11-13 14:10:04,388.85,After window happen plant.
781049919506406122,813590220,4858319769496489,34400918694,2024-12-22 13:00:51,"2,314.45",Fall notice toward blue water.
877249397965384232,293397756,4229246683064576,23172128561,2024-07-26 09:20:29,"1,142.16",Travel say interest.
264340994685419725,129338452,4728231294070267,30182600655,2024-04-08 15:50:51,"1,877.72",Build real send performance hair better.
922201785494548053,877271788,4672224298717476,57453785052,2024-12-23 03:37:55,"3,147.44",Talk keep always low true sit.
441902098332141044,113219054,4611063465386275,66623818978,2024-05-14 10:58:37,"1,915.23",Question surface grow new dream design.
524457590301859043,262969287,4316272112932229,56822720850,2024-06-24 08:54:04,"4,932.27",Foot so none.
429234218108779144,208820779,4539724956650649,24863613250,2025-02-05 20:46:45,"3,391.94",Example scene successful describe important billion.
833895032508122273,378161806,4158430760772922,84529081517,2024-03-20 04:24:43,"3,750.05",Hope live heavy wonder true.
622178534271382749,930325451,4307713204026355,82275363893,2024-05-11 20:21:24,"2,344.49",Television manager pretty sign.
221044239112164086,752607467,4441267137148213,54417937639,2025-02-21 16:58:25,"2,106.52",Occur style everybody coach step song.
623349518686714351,524651801,4609901950916706,50500598497,2024-10-23 02:51:31,"4,976.09",Surface including rule six drive seat.
970029705270105338,332612506,4387494069456259,27942092548,2024-06-22 12:54:05,"4,727.36",Rest kind pass born cut.
518067429832158443,254210672,4514385148490416,62309049379,2024-08-15 22:59:42,"4,648.1",Trade significant foot common choice audience.
835231386627964782,284437812,4774676791828802,74073271821,2024-11-29 17:27:49,"3,001.13",Third challenge single run day back.
100020691248086814,933466687,4872762398298077,90687662399,2024-03-18 17:34:10,"4,171.23",Job able fact our.
664241495302009068,865616547,4008392070585869,59920122556,2025-03-03 06:27:34,785.7,Morning thing doctor yet here learn.
165394428305257309,816745213,4870597844755912,84551783335,2024-11-18 01:11:49,"2,729.02",My area level us.
246501607100512788,128135228,4834237146113909,71556438325,2024-12-19 01:01:20,536.96,Task good deep boy sense.
123836059117606561,564796902,4676984696259480,92519136300,2024-09-25 16:42:55,"3,827.43",Site institution detail board.
375318729358524571,364456832,4859744574782758,75425273603,2024-04-17 05:25:31,950.29,Within position contain.
974989137760035154,124483372,4320446007421845,89805940948,2024-04-29 23:35:10,"4,083.41",Expect sort deep natural story.
665265523199822948,283990926,4695652638676445,94234001608,2024-12-20 08:04:51,"4,952.21",Line along trouble should.
348898284710487505,271402565,4429858358027684,13248877178,2024-05-23 20:32:35,"4,327.86",Simply poor student read eat.
503646770791293147,446314272,4291728044847305,46490873669,2024-12-02 05:28:59,"1,212.72",Stage not painting community attention international.
883652742869105051,833067021,4575982911393615,77955304396,2024-04-04 02:03:11,"4,449.56",Actually participant recently or.
450967056801899348,821296057,4179838840460109,19286972815,2024-05-31 18:20:51,"3,884.43",Challenge rock world laugh improve manage.
427524668667967875,318219309,4772749431005933,63538300368,2024-05-07 23:56:28,"3,343.38",Air product challenge not church special.
825374865220627701,462104937,4073990126162730,89209566817,2024-10-25 11:09:20,"3,851.9",Special course rise support prove.
341568263277506481,302559704,4233946630795628,11574961659,2025-02-08 12:07:38,"3,472.7",Throughout relationship how.
129676316159073662,616862152,4700511318992212,88657265135,2024-12-23 11:02:47,"1,486.91",Five eight call impact.
515250234984266638,819250053,4629391066644739,53017608696,2025-02-17 08:03:06,"1,037.97",Practice commercial visit imagine help system.
472933017283131106,322111225,4422916618387640,88823528209,2024-06-05 04:17:59,"4,803.43",Policy allow interest.
936058380987241277,256503623,4600992759568326,14400783535,2024-08-21 03:31:19,"4,878.63",Hold reality camera security close focus.
440213234335938210,789316017,4935966492114594,15907977711,2024-08-30 11:24:19,"3,778.99",Give fly late new.
290673400101842907,530966024,4324942969114713,18068618840,2024-06-22 02:44:37,520.99,Anything kind Congress strong so.
753312658685687212,219941404,4080638375978667,19155725456,2025-03-01 23:53:14,"4,600.21",Ability sometimes according floor.
694544796736553930,883481434,4661670610904825,65564970011,2024-04-26 09:41:41,"2,918.06",Argue force toward.
317230816462725071,760207424,4147375194410603,73047903583,2024-10-11 07:05:30,"1,308.65",Occur measure scene amount leg top.
913336336429866212,360404176,4283924569196661,74306886845,2024-09-10 22:22:05,"1,154.21",Though child remain usually.
198816380966279949,462244254,4300369143298741,40770872131,2024-10-23 20:02:49,"1,257.8",Very certainly travel six.
616344929150341172,716561346,4723765520845450,92690527923,2024-12-27 13:57:01,264.32,Identify book activity edge certainly admit.
164686231259289185,705842247,4160626469934145,26171513342,2025-02-20 11:40:31,"3,258.7",Look we security country middle.
146522818181321944,944841950,4336936603476401,91109641390,2025-01-13 15:36:02,"2,213.21",Explain town only.
846256750202617316,211834304,4833485197741174,52216401115,2025-01-31 15:21:44,"1,178.56",Bill need in method operation.
934051086251254981,263958621,4181204169430312,54288758724,2025-02-04 07:01:46,"3,832.43",Author control last conference.
305123237874670023,857288817,4569649106325763,79583866608,2024-07-03 23:05:40,"1,277.07",Continue begin firm easy source beat.
331485704222079927,917180181,4892551495769981,93033386770,2024-12-05 12:49:26,"4,471.1",Begin trip chair enter make.
577868694577833662,170670444,4736388249492531,20210073503,2024-03-12 10:07:42,"4,838.26",Little their college.
776893980914503445,701187230,4441900839084662,71379220320,2024-10-23 09:11:14,"4,457.07",Six analysis heavy few.
430428947276346493,530581805,4129894911275786,71118976100,2024-08-30 15:05:59,"3,130.09",Third partner window development yet.
840593428988702608,591926264,4266987696287860,77560686952,2025-02-04 01:23:05,"1,567.32",Gun cost exactly.
657768673262153968,815231761,4931778944986659,68962208541,2024-05-15 03:43:07,726.9,Six report maybe beyond seek.
137238458425391030,341504075,4018283247540499,29864729454,2024-05-18 18:24:29,"1,960.31",Half share decision subject.
692307733450258205,848645864,4234552629999889,84712000337,2024-04-09 09:20:08,"1,293.97",Challenge half idea evening.
825298552675949206,101529550,4646571543023313,25807534223,2024-03-29 23:34:46,"2,819.3",Card nor arrive mean staff.
499731394054204565,402108195,4088393205500024,97330314842,2024-08-10 01:35:03,495.47,Upon board company way.
600490801088843196,261021842,4592128024967148,77829112015,2024-04-26 11:13:55,"1,622.92",Citizen product sure he training.
768016316593980814,170983433,4771832234040587,58545956429,2024-07-17 22:34:23,"3,495.65",Study end close local position real.
591220021571971632,194357519,4930848907720766,54407186856,2024-12-30 07:48:34,"3,661.17",Necessary deep military.
151864314333391535,465177675,4101213554045996,97599497439,2024-03-23 23:26:39,"1,622.98",Itself both because.
485691501194831977,650273924,4742665336711093,81709247999,2025-02-21 02:14:43,359.2,Structure radio catch under right.
390865908497024428,819582743,4864816166850582,62788483804,2024-04-08 07:06:45,"1,136.71",Such industry indeed.
540206301216117345,938899262,4381014315782245,23743895110,2024-05-08 05:35:30,"4,830.09",Large either religious.
733121794338062831,327954311,4694257432753308,80187532449,2024-09-19 03:36:27,868.19,Unit charge thought prove.
931598485171071124,798763924,4459394567360115,87167205495,2025-01-30 00:41:47,"3,861.03",Activity suddenly himself.
891331946549532398,312142352,4766082839610627,63001402062,2024-03-23 02:42:10,611.65,Hundred military difference my describe customer.
900506613051367978,913476583,4209149551971464,26429610920,2024-08-05 08:30:22,"4,407.79",Head able hope stop.
723375432185872309,999131742,4955067397409554,75254861814,2024-07-31 21:48:17,"1,474.2",Stock popular see mean road.
168574528756358771,324124977,4349921047086508,11442524177,2024-03-24 16:59:35,"4,947.92",Several recently not generation police per.
349274220541897838,702097106,4517608222766972,83265945979,2024-05-21 08:37:04,"3,874.9",Card whatever century reduce hand stand.
139998722421233263,510793579,4297570036077101,68625292530,2025-01-27 15:39:48,743.33,Direction view hair fish theory.
299518042683533489,886059338,4973026979897154,44128164404,2024-07-01 17:41:46,"4,593.83",Lead for bit again staff.
220029627650419744,256010209,4087211542798674,71216467163,2024-07-21 05:55:36,"2,408.02",Here society though side citizen not.
255236691929299797,338002290,4987655010903862,30225124695,2024-03-22 16:01:15,"2,353.21",Water some might send left.
819306421242627128,583524408,4985526051914526,63243089612,2024-04-08 14:53:42,871.67,Until upon without open medical.
414032029770159044,638617875,4479275844772154,50273689088,2024-09-03 05:28:59,986.35,For weight camera.
809209697879773836,800742948,4727269000626320,64258475612,2024-06-09 05:37:41,"4,735.97",Face drive start play learn method.
587661622258421545,492132503,4746157891366790,74930676346,2024-07-13 17:01:46,"3,130.32",Positive though class eat individual.
581169181292636571,253399914,4941232458033258,27201417561,2024-04-11 05:14:47,"3,188.57",Ahead finally able.
365295005195466063,966047905,4222823895136082,50169168232,2024-10-21 02:51:13,"4,236.66",Read office sister last prevent section.
310831855111009661,397605462,4266465724978669,54766385214,2024-07-06 08:03:52,"4,691.81",Prove yes until drop plan.
686128498423361768,701001402,4423009716475407,89727504927,2025-01-14 09:01:23,"4,155.68",Education beat music say five.
653234798428482379,911889589,4569422669303738,63737739102,2024-10-07 05:59:34,"2,495.0",Every stuff difficult design fly field.
289752481796499110,149372671,4178373554284611,95219288215,2024-06-20 02:40:42,"3,994.69",Peace pressure when something suddenly instead.
568722361397383263,866834157,4495375062144308,35516155660,2024-04-13 03:33:14,308.82,They day easy join approach series.
537108371865642753,539261538,4208243054521073,79488676964,2024-08-15 10:30:15,956.46,Rest dark explain event address.
884780097902221119,774278464,4142538878885516,89608061519,2024-08-16 04:18:01,"1,718.52",Must break spend computer too off.
515853663057681562,983530431,4499078325210165,86419337283,2025-03-04 18:18:29,"4,875.34",Me whom cost feel practice.
275604839376198154,581141537,4126913903290406,61185860034,2024-04-26 18:09:29,"4,976.93",Her stay free expect how significant.
610358430594531536,500583473,4033008004158040,14019867732,2024-11-19 03:04:01,"4,596.73",Interview physical value audience peace.
757554855830066846,321082988,4184976996089034,79964640877,2024-05-19 08:43:54,"4,676.41",Only more reach environment.
904485600418250619,133632224,4159503550680627,80125000274,2024-08-21 16:45:21,"4,787.39",Chance town every over.
648005417393566333,660487764,4611312157610843,73226894057,2025-01-20 01:18:35,"4,665.81",Full wear reason.
443326871543789838,460261110,4524700396395786,92158136641,2024-03-28 09:56:16,"3,136.06",Cup southern six.
159689002212106902,590953570,4602278898899089,79624008844,2024-07-08 06:31:46,"2,478.5",Push compare issue author.
521659815610365647,153264100,4157180650114021,13214145308,2024-07-19 15:54:12,"2,074.28",Letter bit according ability.
479973526897063156,332066493,4084130042264735,45141784485,2024-03-18 05:17:53,"1,393.46",Small set identify.
411730982030475592,699661158,4771238032911096,56052665672,2024-09-29 04:58:28,280.84,Not become hear either.
128936445510436887,119948682,4184450637212959,60146992076,2024-07-04 16:21:13,952.83,Suddenly in how.
930589897530223419,686175245,4827610423831840,88566990644,2024-08-12 21:55:29,"3,619.69",Measure produce support inside score.
888875665335110803,385594845,4563995429166509,14506428744,2024-05-30 16:18:18,"3,757.04",Success eat amount.
414047028176623625,390760935,4693703153870129,20087522210,2024-06-30 01:22:08,"2,048.75",Reach leg friend truth attention.
584378106036720432,108821300,4720012127134480,51614297348,2024-10-14 08:14:03,"4,228.1",Behavior report beat report give interview.
330103694917927458,806288903,4861614838685582,74182561978,2024-05-02 11:56:24,"3,561.28",My guess oil too message.
687953094646257936,697273188,4372044433419389,90507304156,2024-07-24 14:45:03,"4,659.83",Process century fight boy.
451227225073289695,104199607,4014837158739160,26622367167,2024-07-12 18:10:32,575.59,Election military his pattern office hair.
932008665550688873,994542806,4496377734197879,89041967356,2024-06-05 18:36:52,20.58,Bring true huge.
469517418995633386,803371746,4166052304663704,83865962717,2024-09-18 06:50:28,"4,831.24",Agree six carry production reflect.
580073940653856396,531530539,4314320757345298,58840423103,2024-07-29 02:21:39,"3,351.12",Little necessary sometimes when operation.
280692010450035856,975262659,4389707305965942,34205168914,2025-01-29 01:33:06,"1,156.82",End price hit economic quickly.
880982094209193220,424255530,4392549870195835,29370920815,2024-05-14 10:30:22,"2,806.5",Ground several letter.
230701267065292949,878098735,4459250040615881,75244247039,2024-12-10 02:13:02,768.88,Strong always police set offer.
328543241297683789,801656605,4670072444656466,99448109813,2024-09-30 19:52:50,"2,686.67",Beat listen industry partner debate mouth.
728436331196356306,210331412,4505672819461615,14208073260,2024-12-04 16:22:47,"2,529.7",Single gas such cause.
453544524176327240,712526123,4820585442920765,24835988353,2024-10-05 02:22:02,"1,149.24",Billion case rise community factor produce.
489370318837270080,752323633,4382547008943995,50062453536,2024-04-11 20:56:20,"1,509.2",Meeting account human size guy.
999960786352168239,215631793,4586863799862391,21767043952,2024-07-20 07:36:00,469.55,Police night cover design.
657676664295101548,313031138,4303960953438836,88659061851,2025-01-17 08:03:42,"3,213.04",Because technology speak western size successful.
858560389061843577,184882635,4746832600387978,63805263643,2024-03-24 03:19:05,"3,255.76",Everything behind physical.
545492355645461218,821532457,4948830175753919,43970872896,2024-09-07 13:39:00,"1,636.96",Blood total modern north student.
896709780011171827,177572897,4105744354915489,92680975079,2024-08-19 21:48:55,339.58,Fall low cover a environment meeting.
103823078888183144,846102382,4357917301629362,39102019606,2024-03-09 15:57:09,"2,576.49",Plan marriage tend.
874737460898047120,912302339,4882862113268468,40390366549,2024-03-13 07:18:03,"3,415.44",Discuss section food customer subject generation.
601755379133850184,132798667,4104977507989073,94771067785,2024-11-19 15:23:06,"1,349.56",Whole argue property career.
702089298592152630,176021538,4009812158316399,22369622786,2025-03-07 17:10:35,"3,573.51",Chair south respond million me.
659213132763705015,505921738,4469213890607729,34901520279,2024-05-16 02:03:26,"1,632.65",Next want thing.
509549495697781778,441102641,4264149967058437,56546646590,2024-06-21 17:59:21,"1,500.01",Let among customer benefit minute.
995579439666624130,289976159,4346410328149071,17611892066,2024-05-22 22:42:32,"3,135.86",Box them learn opportunity cut.
950704080587034206,492619190,4752438662266364,24234781288,2024-11-24 11:07:19,851.59,Hope huge class such.
455184924480669525,590151729,4079866640732261,50368159149,2025-02-04 05:22:07,"2,138.93",But red listen matter you.
118274809605200296,401382081,4500190403974567,17811029166,2024-11-14 12:17:52,"3,597.48",Give low college food realize watch.
985919855019722066,513324171,4450097843010227,60319496983,2024-08-27 09:23:14,"3,022.56",Wind population sing sometimes plant student.
772717959682019994,775836735,4064690294217024,47946035981,2024-09-12 06:18:15,974.83,Since middle rise talk.
374735339890890253,223084906,4368780840186055,78359245145,2024-06-22 08:04:39,"3,612.98",Level American too fire.
405024404459987696,281428688,4464620707892630,43137301583,2025-03-08 10:43:27,"1,646.43",Trouble never mission.
379206278412938629,355452986,4462340436937315,77257444086,2024-10-03 19:50:33,"4,309.06",Fear interview same game support environment.
385736743739811796,835112367,4766700942830804,36362534730,2024-05-19 00:58:55,"4,811.86",Usually cause heart strong.
956135901455156715,612393694,4648696405998084,65256241698,2024-04-19 18:05:08,"3,126.72",Congress first campaign leg difficult mouth.
990473376383520228,977523630,4617999368546255,88824767787,2024-09-24 10:31:26,599.98,Race price election blood garden hour.
943029963024975093,900965305,4741350488525267,22302920904,2024-06-04 22:13:16,"1,414.74",Rate hotel out board.
151480167844172775,263048170,4213122650740449,61678784492,2024-12-16 05:10:15,"4,578.95",Section be politics.
839747266737970423,645735654,4060059607270571,14653198516,2024-04-17 08:42:25,516.69,Very notice save.
371694733859029178,987519872,4703765151363124,96653242900,2024-12-24 12:48:41,259.15,Military also performance.
457963644820673534,642581836,4110240561134884,62838851922,2024-09-11 00:47:44,"1,231.92",Society left word with.
583726619913624096,889842389,4548258107368826,23146280453,2024-11-16 01:41:28,"4,863.15",Think high through consumer heart it.
430520010837454123,840352190,4954659149464514,34781823686,2024-09-13 10:49:34,"3,924.63",Let record throw.
813416716414878025,148462493,4282838459612689,15243914818,2024-10-16 15:58:05,"1,807.98",Very home pressure government focus blue.
965798783814404947,247219304,4916408918478850,57571048074,2025-01-19 06:34:58,"4,861.16",Admit between party.
713407174233967420,509535075,4092861872674839,99554470535,2024-09-17 05:24:02,"4,756.37",Relate clearly suffer study early.
207567411076618649,891585148,4181108786132526,34965830295,2024-04-19 19:49:10,"3,100.22",Bit pretty international parent.
745735851703035930,461524861,4695524936870337,56260170398,2025-02-16 04:30:37,"1,908.13",Notice with nor education officer.
948547899755634062,719511387,4048895654428142,24951209248,2024-07-25 03:17:30,"2,170.33",Hot detail do.
361257105992594590,133420620,4323863866533956,14179473241,2024-11-28 11:13:51,"2,183.57",Time oil teacher pull.
122494096806331276,266904974,4644382087479990,66606178856,2024-12-18 17:05:59,"4,247.25",Cover see fire black race.
804761407674729933,199727932,4004601423381311,60961401282,2024-11-05 10:50:02,"3,765.71",Show consumer move support adult.
207443438443351474,297452288,4702802930229002,64301807064,2025-02-12 04:32:37,"3,786.31",He study beautiful amount central since.
377288318120246855,850503569,4085877144047215,33272633154,2025-01-15 23:06:52,227.72,Total myself test movie.
133789809237134653,230028494,4897418407317199,99997792167,2024-05-16 08:00:16,222.29,Human benefit parent.
312438316552106236,409984411,4237897434197881,37222883117,2025-02-18 13:21:48,"1,393.89",Foreign situation bill discover team.
285319595406738528,476983748,4924413518309042,89827231744,2024-06-04 09:27:46,"1,425.41",Concern figure education collection expert best.
329846803051286924,463305629,4031615409225174,11209892229,2024-03-29 15:11:33,"4,113.22",Garden life ask.
946130345497123039,978125235,4920522270405899,67217311718,2024-03-25 18:14:17,"3,676.71",Voice education home buy all heavy.
677937437326221170,611662666,4584437333595163,45903198341,2024-08-27 07:59:24,"4,633.28",Property skin other entire base.
706306871909090163,999555407,4782046069480498,27401026697,2024-05-14 06:20:01,"4,364.46",Sea different collection all many.
182303665367557491,140105711,4150602233081994,46652848446,2024-10-05 16:09:08,458.39,Anyone our return.
882346849549370316,218520788,4653326011560068,80963186008,2024-03-24 19:15:29,478.72,War memory air kid yard involve.
816464984043796073,847593407,4711934249791197,43696760284,2024-11-22 08:24:20,"2,998.47",Evidence worry international.
162676694580971127,572483901,4319367539330515,64227055830,2024-12-11 04:54:49,561.46,Cause play heavy.
352883601708190542,594742338,4766108870783583,28639430815,2025-01-05 20:17:24,"2,028.49",Yeah wear race plan.
939701967712635520,384452235,4192936244483306,57201528554,2024-03-18 22:01:47,"4,030.4",Feeling glass indicate identify effect.
336616674231627955,365843176,4122343708409312,32937572692,2024-09-18 05:45:27,"3,764.04",Picture meeting during manager painting company reason.
304494695991544268,260451234,4290903794593398,56072745359,2024-05-05 08:54:26,"3,190.66",Answer operation middle.
344605133800062675,226697989,4278797929570412,55600280039,2025-02-25 18:03:17,200.7,Among arrive voice degree agreement.
474149347815575916,997038509,4422733735571125,73296127828,2024-11-17 07:44:54,"3,227.78",Read community oil place contain.
212718394172885745,359166274,4610492704066037,55477387236,2025-02-08 22:36:52,"3,702.94",Several way factor wind within.
408155631516948336,949732128,4718958689644791,76125175227,2024-12-13 15:32:54,"4,800.43",Fire first reality why.
113190035647069234,861300140,4864067471903233,33729467364,2024-06-24 18:38:55,"1,949.58",Husband sea talk from she end.
145809208185674298,911578285,4177780419402850,12773808489,2024-08-26 11:50:35,"3,354.38",Important word owner parent.
989848891729107591,469428033,4276602545619134,80165866766,2024-08-19 23:32:29,"1,604.23",Hold whatever through hard career training.
454150203721172923,110259946,4590842321019617,93238645631,2025-01-14 09:37:42,"1,478.22",Pass offer ask majority brother.
230290063161071342,185760696,4422179863994558,59395721717,2024-12-13 20:50:25,"1,325.84",Sort return practice hair car feel.
247877856935141472,348508352,4789798435605702,38531141481,2024-11-02 03:20:25,"4,598.78",Common particularly different recognize develop site.
850498997603105940,241089426,4278680768092146,22120071801,2025-01-30 08:01:07,"2,013.44",Ground increase through speak.
737530098539381184,516308334,4691219369554052,97568423135,2025-03-01 19:46:44,"3,588.26",Determine major natural.
548372216702171528,947373079,4154496720911599,41219709107,2024-03-13 15:26:38,"3,275.77",Few away rule.
201561726789448528,264937980,4618101043019191,88521005718,2024-03-16 01:29:23,"2,447.41",Likely court everybody it material.
672307362022292350,608922501,4637858595793583,83866721437,2024-12-14 22:26:26,"2,706.78",Leave first least may.
961380090730592095,135529765,4729349030735040,37444599430,2024-12-11 00:14:05,163.23,Safe attack skin.
529132791323456963,296226453,4097513716584865,92684154607,2024-05-01 23:46:20,"2,178.29",Eight your audience control he.
742283651889682333,636982617,4942479593024085,79957892250,2024-12-25 11:35:14,"1,820.13",They art individual.
349963375842998155,356051760,4710542712675002,29712774962,2024-09-11 18:48:54,"2,989.26",Red success radio.
630787205853766881,712659485,4988845787025259,61069880565,2024-07-01 17:54:58,"1,069.12",Focus single prevent experience audience general.
395494400236286541,726896284,4138584731474763,24131068429,2024-03-31 03:26:20,"3,256.91",Friend student own.
157620546736837869,263520579,4561518274474927,76972350842,2024-09-16 09:50:10,"1,090.94",Toward wear subject send cold ground.
962363751052976644,971993448,4981728778508953,99094846406,2024-10-16 09:27:41,"4,203.02",Response first never beautiful certain six.
456293838468498685,843470553,4243704234703110,98773091118,2024-11-22 00:43:13,"1,963.13",Give room daughter interview.
516189595624536122,208687886,4429610253530902,13827718013,2024-08-19 05:38:05,"4,503.22",Gun simple art poor.
982792171169494237,354130764,4442406452790618,91835667800,2024-05-27 17:09:17,"1,216.81",Beyond study buy challenge author no.
582146988878653897,792440715,4295292408363363,32566240269,2025-02-07 10:59:38,"1,886.8",Occur provide candidate community most.
997620150545538351,889025020,4981475154682404,31478334114,2024-04-25 04:08:24,"3,172.81",Collection approach himself reason officer six.
252725022186730628,503890605,4574477887269999,20586306378,2024-08-30 19:14:28,"3,839.0",Example southern continue hour interesting finish.
790383012717161353,953561350,4459215459358620,62261146303,2025-03-05 23:53:27,"4,090.69",Decision attorney page whole thought full.
946915285526578497,541254899,4275953877360891,49825895377,2025-01-08 11:13:39,"4,862.51",Today amount believe.
312272907266337787,991355525,4120122523489846,18050849381,2024-05-31 15:22:15,266.59,Television drug health.
942227214808947139,876707147,4395951782123821,35590247051,2024-08-06 02:29:54,"2,681.59",Buy include walk box soldier lay.
837412289553405664,831856431,4316120218731385,39342868983,2024-07-25 21:53:07,"1,330.66",Sign south reality value specific myself.
659007215397225447,506357339,4115376021876865,20541280382,2024-11-27 05:39:38,"2,326.61",From need this hear can movie.
